Authors;Title;Year;Affiliations;Author Keywords
ROCHA A.M.D., FERNANDES T.B.;Estrutura organizacional de bibliotecas especializadas: análise do modelo de gestão da rede ametista de bibliotecas do serviço geológico do Brasil;2014;"Universidade Federal do Amazonas; Universidade Federal do Amazonas";"Biblioteconomia; Estrutura Organizacional  Bibliotecas; Bibliotecas Especializadas; Redes de Bibliotecas"
SILVA A.K.S.D., MARQUEZ S.O.M.;Leitura no âmbito escolar: bibliotecários escolares e professores como agentes incentivadores de crianças à prática da leitura.;2014;"Universidade Federal do Amazonas; Universidade Federal do Amazonas";"Leitura; Biblioteca escolar; Formação de leitores; Bibliotecário escolar; Professores; Biblioteconomia  Monografia"
RIBEIRO A.N., MARQUEZ S.O.M.;A literatura e o cinema na formação de leitores;2017;"Universidade Federal do Amazonas; Universidade Federal do Amazonas";"Leitura; Literatura; Cinema; Leitor"
ROCHA A.G., MARQUEZ S.O.M.;Biblioteca escolar: processo de marketing no setor de referência;2013;"Universidade Federal do Amazonas; Universidade Federal do Amazonas";"Biblioteca escolar; Serviço de referência; Marketing"
SILVA A.S., BESSA A.D.Q.;O perfil do bibliotecário da sociedade contemporânea;2013;"Universidade Federal do Amazonas; Universidade Federal do Amazonas";"Sociedade; Profissional da informação; Bibliotecário"
PONTES A.L., TERRA G.D.M.;Aplicabilidade das funções administrativas para o melhor desempenho das unidades de informação;2013;"Universidade Federal do Amazonas; Universidade Federal do Amazonas";"Funções administrativas  Unidades de Informação; Gestão"
BARBOSA A.L.D.S., LIMA R.M.D.;Contribuição da biblioteca das escolas públicas estaduais de ensino médio de Manaus aos alunos terceiranistas aprovados no processo seletivo contínuo de 2014;2015;"Universidade Federal do Amazonas; Universidade Federal do Amazonas";"Biblioteca escolar  estruturação e funcionamento; Biblioteca escolar  serviços aos usuários; Processo seletivo contínuo"
AGUIAR A.M.D., BORGES V.J.;Adequação de acervo em bibliotecas universitárias: uma avaliação da coleção didática do curso de Administração da biblioteca ESO/UEA ;2016;"Universidade Federal do Amazonas; Universidade Federal do Amazonas";"Biblioteca universitária; Avaliação de acervo; Parâmetros do MEC"
PASSOS A.P.B.D., BESSA A.D.Q.;Parâmetros para avaliação de acervo: um estudo de caso em uma biblioteca escolar;2013;"Universidade Federal do Amazonas; Universidade Federal do Amazonas";"Biblioteca escolar; Desenvolvimento de coleções; Seleção; Aquisição; Avaliação de acervo"
OLIVEIRA A.A.D.O., BORGES V.J.;A biblioteca prisional como apoio à educação no centro de detenção provisória masculina de Manaus - CDPMM;2015;"Universidade Federal do Amazonas; Universidade Federal do Amazonas";"Biblioteca prisional; Educação prisional; Sistema penitenciário do Amazonas"
FONSECA A.M., LIMA R.M.D.;Desenvolvimento de coleções em biblioteca especializada;2016;"Universidade Federal do Amazonas; Universidade Federal do Amazonas";"Biblioteca especializada; Desenvolvimento de coleções; Política de desenvolvimento de coleções - CPRM"
CARVALHO A.K.G., BORGES V.J.;Biblioteca prisional: a biblioteca como auxílio ao usuário apenado;2016;"Universidade Federal do Amazonas; Universidade Federal do Amazonas";"Biblioteca prisional; Satisfação do usuário; Sistema penitenciário do Amazonas; Usuário apenado"
ORTIZ B.D.F., TERRA G.D.M.;Sistemas de classificação bibliográfica: estudo comparativo entre os termos empregados na Classificação Decimal Universal e na Classificação Decimal de Direito, na esfera dos Atos Administrativos em Espécie;2018;"Universidade Federal do Amazonas; Universidade Federal do Amazonas";"Classificação Decimal de Direito (CDDir); Classificação Decimal Universal (CDU); Organização do conhecimento; Recuperação da informação; Atos administrativos em espécie."
SANTOS B.S.D., MARQUEZ S.O.M.;Educação de usuários na biblioteca setorial do setor norte da UFAM: um estudo de caso;2014;"Universidade Federal do Amazonas; Universidade Federal do Amazonas";"Educação de Usuários; Habilidades e competências informacionais; Bibliotecas universitárias; Biblioteca Setorial do Setor Norte  UFAM"
SETUBAL C.D.S., FERNANDES T.B.;A atuação do bibliotecário no contexto da gestão do conhecimento;2014;"Universidade Federal do Amazonas; Universidade Federal do Amazonas";"Bibliotecário; Gestão do conhecimento; Competências e habilidades"
MACEDO C.M.D.A., BOTELHO D.E.;Satisfação dos usuários em bibliotecas especializadas;2016;"Universidade Federal do Amazonas; Universidade Federal do Amazonas";"Bibliotecas especializadas; Satisfação de usuários; Demandas informacionais"
MUNIZ C.D.S., BARBALHO C.R.S.;Biblioteca itinerante como incentivo a leitura: BIBLIOSESC/AM;2014;"Universidade Federal do Amazonas; Universidade Federal do Amazonas";"Incentivo à leitura; Biblioteca escolar e biblioteca itinerante"
ANJOS, C.F.D., BORGES V.J.;Expectativas dos formandos de Biblioteconomia da Universidade Federal do Amazonas quanto ao mercado de trabalho;2014;"Universidade Federal do Amazonas; Universidade Federal do Amazonas";"Biblioteconomia; Mercado de trabalho; Perfil."
SILVA C.U.D.C.E., BESSA A.D.Q.;Pesquisa escolar: a interação do bibliotecário com o professor;2013;"Universidade Federal do Amazonas; Universidade Federal do Amazonas";"Biblioteca escolar; Pesquisa escolar; Professor; Bibliotecário"
SOARES D.D.M., FERNANDES T.B.;O profissional da informação: formação e perspectivas dos alunos finalistas do curso de Biblioteconomia da UFAM do ano de 2013;2013;"Universidade Federal do Amazonas; Universidade Federal do Amazonas";"Profissional da informação; Perspectivas profissionais; Biblioteconomia; Formação profissional"
BARRETO, D. P., BARBALHO C.R.S.;Biblioteca escolar e letramento informacional: em face a atuação da biblioteca do colégio Dom Bosco junto aos alunos do ensino fundamental I;2016;"Universidade Federal do Amazonas; Universidade Federal do Amazonas";"Letramento informacional; Biblioteca; Interação entre biblioteca e área pedagógica; Recurso pedagógico"
SEVALHO D.S., LIMA R.M.D.;A biblioteca nas escolas da rede pública municipal de ensino fundamental de Manaus: estudo comparativo sobre os impactos da sua estruturação e serviços prestados aos usuários;2015;"Universidade Federal do Amazonas; Universidade Federal do Amazonas";"Biblioteca escolar  estrutura e funcionamento; Biblioteca escolar  serviços aos usuários; Biblioteca escolar  gestão; Ensino fundamental."
MELLO D.C.D.S., BORGES V.J.;Revisão bibliográfica: critérios para implementação de software de gerenciamento de bibliotecas;2014;"Universidade Federal do Amazonas; Universidade Federal do Amazonas";"Automação de biblioteca; Softwares para biblioteca; Implementação de softwares"
GARCIA D.D.A., LIMA R.M.D.;Biblioteca setorial norte da Universidade Federal do Amazonas: estudo sobre a estruturação e o atendimento aos usuários com deficiência auditiva da UFAM;2016;"Universidade Federal do Amazonas; Universidade Federal do Amazonas";"Biblioteca Universitária; Usuário Surdo; Acessibilidade; Satisfação de usuário"
SANTOS D.S.D., MARQUEZ S.O.M.;A inclusão social da pessoa com deficiência visual na Biblioteca Braille do Amazonas (BBAM);2016;"Universidade Federal do Amazonas; Universidade Federal do Amazonas";"Inclusão social; Deficiência visual; Biblioteca Braille; Tecnologias assistivas"
JESUS D.D.S.D., BOTELHO D.E.;Ações culturais nas bibliotecas escolares: uma revisão de literatura;2017;"Universidade Federal do Amazonas; Universidade Federal do Amazonas";"Ações culturais; Biblioteca escolar; Agentes culturais"
SOARES E.D.P., TERRA G.D.M.;O papel social das bibliotecas na contemporaneidade ;2016;"Universidade Federal do Amazonas; Universidade Federal do Amazonas";"Biblioteca  Papel social; Biblioteca  Organização; Biblioteca  Contemporaneidade"
NÓBREGA E.P., BORGES V.J.;Satisfação dos usuários relacionada à qualidade dos produtos e serviços na biblioteca de uma escola municipal na zona Sul de Manaus;2014;"Universidade Federal do Amazonas; Universidade Federal do Amazonas";"Incentivo à leitura; Biblioteca escolar; Papel do bibliotecário escolar; Atores do incentivo à leitura"
ALEXANDRINO E.R., BESSA A.D.Q.;A promoção da leitura em escolas públicas estaduais da zona Oeste na cidade de Manaus-AM;2015;"Universidade Federal do Amazonas; Universidade Federal do Amazonas";"Promoção da Leitura - Profissionais que coordenam a biblioteca e Professores; Escolas Públicas Estaduais  Manaus; Atividades de Leitura; Biblioteca escolar"
MIRANDA E.G., BORGES V.J.;Atividades lúdicas como instrumento de incentivo à leitura em bibliotecas escolares ;2017;"Universidade Federal do Amazonas; Universidade Federal do Amazonas";"Lúdico; Leitura; Biblioteca Escolar"
ROCHA E.R.D., CAVALCANTE K.V.;Biblioteca prisional: o centro de detenção provisória de Manaus, AM;2014;"Universidade Federal do Amazonas; Universidade Federal do Amazonas";"Bibliotecas prisionais; Centro de Detenção Provisória de Manaus; Detentos"
FERREIRA F.G.D., BORGES V.J.;Os conhecimentos da administração que contribuem à formação dos bibliotecários ;2015;"Universidade Federal do Amazonas; Universidade Federal do Amazonas";"Administração; Biblioteconomia; Bibliotecário gestor"
COSTA F.M., BORGES V.J.;Escolha profissional em Biblioteconomia: motivos e expectativas;2014;"Universidade Federal do Amazonas; Universidade Federal do Amazonas";"Biblioteconomia  Escolha profissional; Biblioteconomia  Motivações; Biblioteconomia  Expectativa; Biblioteconomia  Ingressantes"
LEITE G.K.O., MARQUEZ S.O.M;Biblioteca Braille do Estado do Amazonas: A atuação do setor ao atendimento dos deficientes visuais;2017;"Universidade Federal do Amazonas; Universidade Federal do Amazonas";"Biblioteca Braille; Deficiente visual; Biblioteca Pública do Amazonas; Biblioteca Braille do Amazonas"
LIMA G.A.M., BESSA A.D.Q.;Incentivo à leitura: estudo de caso das ações realizadas pelo Instituto Ler para Crescer no Bairro Colônia Antônio Aleixo em Manaus, Amazonas.;2015;"Universidade Federal do Amazonas; Universidade Federal do Amazonas";"Incentivo à leitura; Instituto Ler para Crescer; Planejamento de ações de incentivo à leitura; Organizações não governamentais"
SANTANA G.T.S.,  CALDAS A.L.V.;Biblioteca universitária: a satisfação do usuário da biblioteca setorial da faculdade de direito da UFAM.;2013;"Universidade Federal do Amazonas; Universidade Federal do Amazonas";"Estudos de usuários; Satisfação do usuário; Biblioteca universitária"
ROCHA G.D.S., BESSA A.D.Q.;A promoção da leitura em uma biblioteca infantil na cidade de Manaus-AM;2017;"Universidade Federal do Amazonas; Universidade Federal do Amazonas";"Promoção da leitura; Biblioteca Infantil; Manaus-Amazonas"
BATALHA G.M., BESSA A.D.Q.;O papel do bibliotecário escolar como mediador de atividades lúdicas de incentivo à leitura;2017;"Universidade Federal do Amazonas; Universidade Federal do Amazonas";"Bibliotecário escolar; Mediação de leitura; Atividades lúdicas"
FERREIRA G.L.N., TERRA G.D.M.;A importância da sinalização para o funcionamento das bibliotecas universitárias: modelo adotado pela Faculdade La Salle/Manaus-AM;2016;"Universidade Federal do Amazonas; Universidade Federal do Amazonas";"Bibliotecas universitárias; Sinalização de bibliotecas; Faculdade La Salle/Manaus-AM"
SOUZA G.F., CALDAS A.L.V.;Estudo dos usuários: uma análise dos serviços prestados pela biblioteca setorial do setor norte da UFAM;2013;"Universidade Federal do Amazonas; Universidade Federal do Amazonas";"Estudo do usuário; Biblioteca Universitária; Satisfação dos usuários"
BRAGA H.A., LIMA R.M.D.;Biblioteca da FUCAPI: estudo sobre a adequação da coleção da área de engenharia de produção aos parâmetros do MEC;2016;"Universidade Federal do Amazonas; Universidade Federal do Amazonas";"Biblioteca universitária; Ministério da Educação e Cultura; Adequação do acervo."
PINTO J.S., BARBALHO C.R.S.;A contribuição do ambiente físico da biblioteca infantil Emídio Vaz para o incentivo à leitura;2017;"Universidade Federal do Amazonas; Universidade Federal do Amazonas";"Leitura; Ambiente; Espaço físico; Biblioteca infantil"
MONTE J.C.P., BESSA A.D.Q.;Avaliação da qualidade em serviços de bibliotecas universitárias: um estudo de caso;2015;"Universidade Federal do Amazonas; Universidade Federal do Amazonas";"Qualidade em serviços; Unidades de informação; Biblioteca Universitária; Avaliação da Qualidade"
REIS J.L.D., BARBALHO C.R.S.;Estrutura organizacional de bibliotecas universitárias;2013;"Universidade Federal do Amazonas; Universidade Federal do Amazonas";"Estruturas organizacionais; Bibliotecas universitárias; Organização de bibliotecas"
ALAÚZO J.L.C., FERNANDES T.B.;Avaliação das funcionalidades do software livre de automação de bibliotecas biblivre;2013;"Universidade Federal do Amazonas; Universidade Federal do Amazonas";"Biblivre; Avaliação de funcionalidades; Software de automação de bibliotecas"
NETO RODRIGUES J.B, MARQUEZ S.O.M.;Biblioteconomia no Amazonas: o ensino em foco;2013;"Universidade Federal do Amazonas; Universidade Federal do Amazonas";"Dificuldade de aprendizagem; Ensino; Graduação em Biblioteconomia"
PINHEIRO K.C.D.S., FERNANDES T.B.;Perfil do usuário e demanda informacional: um estudo em biblioteca especializada;2013;"Universidade Federal do Amazonas; Universidade Federal do Amazonas";"Perfil do usuário; Demanda informacional; Biblioteca especializada"
REMIGIO L.G., BARBALHO C.R.S.;Biblioteca digital de teses e dissertações do Instituto Nacional de Pesquisas da Amazônia: um estudo do período de 2010 a 2012;2014;"Universidade Federal do Amazonas; Universidade Federal do Amazonas";"Biblioteca digital; Biblioteca Digital de Teses e Dissertações  INPA; Divulgação da ciência"
SILVA L.L.D., CAVALCANTE K.V.;O blog: ferramenta de webmarketing em bibliotecas;2017;"Universidade Federal do Amazonas; Universidade Federal do Amazonas";"Web 2.0; Blogs; Webmarketing; Biblioteca Híbrida"
NOGUEIRA L.M., MARQUEZ S.O.M.;A contribuição da biblioteca digital na preservação e acesso às obras raras;2015;"Universidade Federal do Amazonas; Universidade Federal do Amazonas";"Biblioteca digital; Obras raras; Digitalização; Preservação de documento; Preservação digital"
XAVIER L.R., BOTELHO D.E.;Bibliotecário clínico: uma revisão de literatura;2014;"Universidade Federal do Amazonas; Universidade Federal do Amazonas";"Bibliotecário clínico; Biblioteconomia clínica; Equipe médica"
BRANDÃO L.H.T., BOTELHO D.E.;Estudo bibliográfico dos serviços prestados em bibliotecas especializadas;2015;"Universidade Federal do Amazonas; Universidade Federal do Amazonas";"Biblioteca especializada; Serviços-qualidade-avaliação; Perfil do bibliotecário "
SILVA L.D.F.D., BOTELHO D.E.;Vantagens e desvantagens do livre acesso do público ao acervo de uma biblioteca: um estudo do modelo da Biblioteca Pública do Estado do Amazonas;2015;"Universidade Federal do Amazonas; Universidade Federal do Amazonas";"Biblioteca pública  Brasil  Amazonas (estado); Acervo  consulta; Livre acesso  estantes"
SANTOS M.M.D., MARQUEZ S.O.M.;Normas para publicação de artigos científicos na área de dermatologia utilizando a prova dos 9 como parâmetro de medição;2017;"Universidade Federal do Amazonas; Universidade Federal do Amazonas";"Regras de publicação; Normas para autores; Norma de Vancouver"
SILVA M.F.D., FERNANDES T.B.;Desenvolvimento de coleções: um estudo em biblioteca universitária;2013;"Universidade Federal do Amazonas; Universidade Federal do Amazonas";"Biblioteca Universitária; Desenvolvimento de coleções"
AUZIER M.O., CAVALCANTE K.V.;Semiótica e leitura: feira de livros;2018;"Universidade Federal do Amazonas; Universidade Federal do Amazonas";Biblioteca escolar. Leitura. Feira de livros. Semiótica. Peças publicitárias.
SMITH M.A.C.D.S., FERNANDES T.B.;Marketing aplicado a unidades de informação: apresentação de casos;2013;"Universidade Federal do Amazonas; Universidade Federal do Amazonas";"Biblioteconomia; Marketing; Unidades de Informação"
VALENTIM M.G.R., BESSA A.D.Q.;O projeto Barco-Biblioteca do Instituto Ler para crescer e a promoção da leitura nas comunidades ribeirinhas do Amazonas;2017;"Universidade Federal do Amazonas; Universidade Federal do Amazonas";"Projeto Barco-Biblioteca; Promoção à leitura; Voluntários; Comunidades ribeirinhas"
SILVA M.S.L.C., MARQUEZ S.O.M.;As competências geradas pelas estruturas curriculares dos cursos de Biblioteconomia das Universidades Federais da região Norte ;2015;"Universidade Federal do Amazonas; Universidade Federal do Amazonas";"Competências; Habilidades; Biblioteconomia; Região Norte"
MONTEIRO M.A., BOTELHO D.E.;Arquivo como fonte de informação: estudo de caso do Instituto Médico Legal Dr. Antônio Hosannah da Silva Filho - IML/AM;2015;"Universidade Federal do Amazonas; Universidade Federal do Amazonas";"Arquivo público; Sociedade da informação; Fonte de informação; Arquivo do IML/AM"
PIRANGI M.G.A., CAVALCANTE K.V.;Software livre: uso e aplicabilidade em bibliotecas;2018;"Universidade Federal do Amazonas; Universidade Federal do Amazonas";"Software livre; Automação de bibliotecas; Tecnologias da informação e comunicação"
SOUSA M.C.D., BARBALHO C.R.S.;O perfil do bibliotecário empreendedor: um estudo na rede ametista de bibliotecas do Serviço Geológico do Brasil;2014;"Universidade Federal do Amazonas; Universidade Federal do Amazonas";"Empreendedorismo; Perfil do bibliotecário; Intraempreendedorismo"
SEIXAS M.D., BOTELHO D.E.;Treinamento de auxiliares e estagiários em relação ao atendimento dos usuários no balcão de referência de uma biblioteca pública: estudo de caso do modelo da Biblioteca Pública do Estado do Amazonas;2015;"Universidade Federal do Amazonas; Universidade Federal do Amazonas";"Biblioteca pública; Balcão de referência; Treinamento de auxiliares e estagiários"
CRUZ JÚNIOR M.J.A., BOTELHO D.E.;O uso do Comut pelos discentes dos programas de pós-graduação do Instituto de Ciências Humanas e Letras da Universidade Federal do Amazonas: estudo de caso;2013;"Universidade Federal do Amazonas; Universidade Federal do Amazonas";"Programa de Comutação Bibliográfica  COMUT; Tecnologias de Informação e Comunicação  TICs; Bibliotecas Universitárias"
SILVA M.B.D., BORGES V.J.;Uso da biblioterapia como apoio ao tratamento de crianças hospitalizadas;2015;"Universidade Federal do Amazonas; Universidade Federal do Amazonas";"Biblioterapia; Hospital; Leitura"
NASCIMENTO IRMÃO M., BARBALHO C.R.S.;Competências gerenciais dos gestores de bibliotecas universitárias de instituições de ensino público em Manaus;2013;"Universidade Federal do Amazonas; Universidade Federal do Amazonas";"Bibliotecário gestor; Biblioteca universitária de instituição pública; Competências gerenciais; Perfil do gestor."
SANTOS M.A.D., MARQUEZ S.O.M.;Biblioterapia: a contribuição da biblioterapia no tratamento de pacientes internados em unidades hospitalares;2017;"Universidade Federal do Amazonas; Universidade Federal do Amazonas";"Biblioterapia; Leitura terapêutica; Biblioterapêuta"
SOUZA M.G.D., BARBALHO C.R.S.;Os direitos do autor e as implicações do acesso livre na internet;2016;"Universidade Federal do Amazonas; Universidade Federal do Amazonas";"Direito Autoral; Direitos do autor na Internet; Lei nº 9.610/98"
LOPES M.D.S., BARBALHO C.R.S.;Leitura e biblioteca: incentivo à competência leitora no ensino fundamental;2014;"Universidade Federal do Amazonas; Universidade Federal do Amazonas";"Leitura e biblioteca; Ensino fundamental; Competência informacional"
NOGUEIRA N.S.D., TERRA G.D.M.;Fantoches na biblioteca escolar: uma ferramenta de incentivo à leitura;2017;"Universidade Federal do Amazonas; Universidade Federal do Amazonas";"Biblioteca escolar; Incentivo à leitura; Educação infantil; Fantoches; Bonecos"
SOUZA P.S.D., BARBALHO C.R.S.;Gestão da qualidade em unidades de informação: o caso da Fundação Centro de Análise, Pesquisa e Inovação Tecnológica - FUCAPI;2013;"Universidade Federal do Amazonas; Universidade Federal do Amazonas";"FUCAPI; Indicadores da qualidade; Gestão da qualidade; NBR ISO 9001; Padronização; Unidades de informação"
GARCIA P.L., MARQUEZ S.O.M.;A representação temática no âmbito da Biblioteca Genesino Braga: uma análise das linguagens documentárias;2013;"Universidade Federal do Amazonas; Universidade Federal do Amazonas";"Representação temática; Classificação; Indexação; Linguagens documentárias"
SIMÕES P.P., MARQUEZ S.O.M.;Concursos públicos em Biblioteconomia no Amazonas: um estudo comparativo dos conteúdos da estrutura curricular do curso de Biblioteconomia da Universidade Federal do Amazonas em relação a provas aplicadas em 2010 a 2013 no estado do Amazonas;2015;"Universidade Federal do Amazonas; Universidade Federal do Amazonas";"Mercado de Trabalho; Concursos Públicos; Ensino-Biblioteconomia"
SOARES P.C., BORGES V.J.;A imagem do profissional bibliotecário no filme cinematográfico: O Guardião em Busca da Lança Sagrada;2017;"Universidade Federal do Amazonas; Universidade Federal do Amazonas";"Imagem do bibliotecário; Representação social; Imagens fílmicas; Perfil do profissional bibliotecário"
FERREIRA R.D.E.S.D.A., BARBALHO C.R.S.;Organização de acervo raro: um estudo de caso da Biblioteca do Instituto Nacional de Pesquisas da Amazônia (Inpa);2014;"Universidade Federal do Amazonas; Universidade Federal do Amazonas";"Obras raras; Métodos de organização; Preservação; Conservação; Biblioteconomia de livros raros"
RIBEIRO R.B., BORGES V.J.;A importância e o uso de tecnologia da informação e comunicação (tics) no processo de ensino-aprendizagem no curso de Biblioteconomia da Universidade Federal do Amazonas;2015;"Universidade Federal do Amazonas; Universidade Federal do Amazonas";"Tecnologia da Informação e Comunicação; Ensino-aprendizagem; Curso-Biblioteconomia"
PINHEIRO R.D.S., BESSA A.D.Q.;Incentivo à leitura: a prática de atividades lúdicas em bibliotecas escolares;2013;"Universidade Federal do Amazonas; Universidade Federal do Amazonas";"Biblioteca escolar; Incentivo à leitura; Atividades lúdicas; Bibliotecário escolar; Professor"
XAVIER R.L.D.N., BORGES V.J.;Satisfação dos usuários sobre os serviços de referência da biblioteca do setor norte da Universidade Federal do Amazonas;2014;"Universidade Federal do Amazonas; Universidade Federal do Amazonas";"Serviços de Referência; Satisfação do Usuário; Qualidade dos Serviços; Biblioteca Universitária"
MOURA R.L.D.S., BORGES V.J.;Documento patente como fonte de informação;2015;"Universidade Federal do Amazonas; Universidade Federal do Amazonas";"Propriedade Industrial; Patente; Fonte de Informação"
LIMA R.P., FERNANDES T.B.;Perfil do bibliotecário gestor: um estudo em uma biblioteca universitária;2014;"Universidade Federal do Amazonas; Universidade Federal do Amazonas";"Biblioteca universitária; Perfil do bibliotecário; Bibliotecário gestor"
CALDAS R.R., LIMA R.M.D.;Biblioteca escolar na formação das habilidades e competências em leitura no ensino fundamental;2015;"Universidade Federal do Amazonas; Universidade Federal do Amazonas";"Biblioteca escolar; Projetos de leitura; Habilidades em leitura; Competências em leitura"
ANDRADE R.N.D., BESSA A.D.Q.;A interação entre bibliotecário e professores na formação de leitores em uma escola pública na cidade de Manaus, Amazonas;2013;"Universidade Federal do Amazonas; Universidade Federal do Amazonas";"Biblioteca escolar; Bibliotecário; Leitores; Formação de leitores"
MENEZES S.D.S., BOTELHO D.E.;A Biblioteca Escolar Paulo Reglus Neves Freire: um estudo sobre a sua estruturação;2016;"Universidade Federal do Amazonas; Universidade Federal do Amazonas";"Biblioteca; Biblioteca escolar; Estrutura física"
MELO S.D.S., BOTELHO D.E.;O acesso à leitura da pessoa com deficiência visual: um estudo de caso da biblioteca Braille do Amazonas;2014;"Universidade Federal do Amazonas; Universidade Federal do Amazonas";"Acessibilidade; Biblioteca Braille; Leitura; Pessoa com deficiência visual; Tecnologias assistivas"
VICENTE S.D.S., BOTELHO D.E.;Serviços e produtos oferecidos pela biblioteca setorial do Museu Amazônico: um estudo realizado com os discentes do programa de pós-graduação em antropologia social;2016;"Universidade Federal do Amazonas; Universidade Federal do Amazonas";"Biblioteca; Serviços e produtos; Divulgação"
SANTOS T.R.D., BORGES V.J.;A missão organizacional nos serviços de uma biblioteca especializada;2017;"Universidade Federal do Amazonas; Universidade Federal do Amazonas";"Missão organizacional; Biblioteca especializada; Serviços de biblioteca "
CASTRO T.G.D., FERNANDES T.B.;O uso da internet como ferramenta na pesquisa escolar: um estudo de caso;2015;"Universidade Federal do Amazonas; Universidade Federal do Amazonas";"Pesquisa escolar; Internet; Alunos"
ULISSES T.L.M, FERNANDES T.B.;Normalização de trabalhos de conclusão de curso: uma análise de Tccs do curso de Biblioteconomia da Universidade Federal do Amazonas entre os anos de 2013 a 2014;2015;"Universidade Federal do Amazonas; Universidade Federal do Amazonas";"Normalização Documentária; ABNT; Trabalho de Conclusão de Curso"
SILVA T.S.D., BARBALHO C.R.S.;Plano de marketing para bibliotecas;2013;"Universidade Federal do Amazonas; Universidade Federal do Amazonas";"Ciência da informação; Bibliotecas; Plano de marketing"
